{
  "$schema": "../../../schemas/human-evaluation.schema.json",
  "schemaVersion": 1,
  "runId": "2026-08-08T014422Z-openrouter-moonshotai-kimi-k3-opencode",
  "updatedAt": null,
  "reviewer": null,
  "reviewerRank": null,
  "problems": [
    {
      "file": "problem-01.sgf",
      "status": "pending",
      "targetDifficulty": "20–30 kyu",
      "estimatedDifficulty": null,
      "structuralGate": null,
      "localDuplicateGate": null,
      "remoteDuplicateGate": null,
      "scores": {
        "correctness": null,
        "treeCompleteness": null,
        "canonicalStyle": null,
        "pedagogicalFit": null,
        "originality": null,
        "total": null
      },
      "notes": ""
    },
    {
      "file": "problem-02.sgf",
      "status": "pending",
      "targetDifficulty": "20–30 kyu",
      "estimatedDifficulty": null,
      "structuralGate": null,
      "localDuplicateGate": null,
      "remoteDuplicateGate": null,
      "scores": {
        "correctness": null,
        "treeCompleteness": null,
        "canonicalStyle": null,
        "pedagogicalFit": null,
        "originality": null,
        "total": null
      },
      "notes": ""
    },
    {
      "file": "problem-03.sgf",
      "status": "pending",
      "targetDifficulty": "10–19 kyu",
      "estimatedDifficulty": null,
      "structuralGate": null,
      "localDuplicateGate": null,
      "remoteDuplicateGate": null,
      "scores": {
        "correctness": null,
        "treeCompleteness": null,
        "canonicalStyle": null,
        "pedagogicalFit": null,
        "originality": null,
        "total": null
      },
      "notes": ""
    },
    {
      "file": "problem-04.sgf",
      "status": "pending",
      "targetDifficulty": "10–19 kyu",
      "estimatedDifficulty": null,
      "structuralGate": null,
      "localDuplicateGate": null,
      "remoteDuplicateGate": null,
      "scores": {
        "correctness": null,
        "treeCompleteness": null,
        "canonicalStyle": null,
        "pedagogicalFit": null,
        "originality": null,
        "total": null
      },
      "notes": ""
    },
    {
      "file": "problem-05.sgf",
      "status": "pending",
      "targetDifficulty": "5–9 kyu",
      "estimatedDifficulty": null,
      "structuralGate": null,
      "localDuplicateGate": null,
      "remoteDuplicateGate": null,
      "scores": {
        "correctness": null,
        "treeCompleteness": null,
        "canonicalStyle": null,
        "pedagogicalFit": null,
        "originality": null,
        "total": null
      },
      "notes": ""
    },
    {
      "file": "problem-06.sgf",
      "status": "pending",
      "targetDifficulty": "5–9 kyu",
      "estimatedDifficulty": null,
      "structuralGate": null,
      "localDuplicateGate": null,
      "remoteDuplicateGate": null,
      "scores": {
        "correctness": null,
        "treeCompleteness": null,
        "canonicalStyle": null,
        "pedagogicalFit": null,
        "originality": null,
        "total": null
      },
      "notes": ""
    },
    {
      "file": "problem-07.sgf",
      "status": "pending",
      "targetDifficulty": "1–4 kyu",
      "estimatedDifficulty": null,
      "structuralGate": null,
      "localDuplicateGate": null,
      "remoteDuplicateGate": null,
      "scores": {
        "correctness": null,
        "treeCompleteness": null,
        "canonicalStyle": null,
        "pedagogicalFit": null,
        "originality": null,
        "total": null
      },
      "notes": ""
    },
    {
      "file": "problem-08.sgf",
      "status": "pending",
      "targetDifficulty": "1–4 kyu",
      "estimatedDifficulty": null,
      "structuralGate": null,
      "localDuplicateGate": null,
      "remoteDuplicateGate": null,
      "scores": {
        "correctness": null,
        "treeCompleteness": null,
        "canonicalStyle": null,
        "pedagogicalFit": null,
        "originality": null,
        "total": null
      },
      "notes": ""
    },
    {
      "file": "problem-09.sgf",
      "status": "pending",
      "targetDifficulty": "about 1 dan",
      "estimatedDifficulty": null,
      "structuralGate": null,
      "localDuplicateGate": null,
      "remoteDuplicateGate": null,
      "scores": {
        "correctness": null,
        "treeCompleteness": null,
        "canonicalStyle": null,
        "pedagogicalFit": null,
        "originality": null,
        "total": null
      },
      "notes": ""
    },
    {
      "file": "problem-10.sgf",
      "status": "pending",
      "targetDifficulty": "about 1 dan",
      "estimatedDifficulty": null,
      "structuralGate": null,
      "localDuplicateGate": null,
      "remoteDuplicateGate": null,
      "scores": {
        "correctness": null,
        "treeCompleteness": null,
        "canonicalStyle": null,
        "pedagogicalFit": null,
        "originality": null,
        "total": null
      },
      "notes": ""
    }
  ]
}
